{
  "schema_version": 2,
  "assessment_id": "assessment:mutant-blocking-question-omitted-q071",
  "assessed_target": {
    "kind": "research_corpus",
    "ref": "origin/research-corpus",
    "sha": "a749fb7a8d4e4c59ef7f508d5dd662449d858f39"
  },
  "assessed_at": "2026-08-18T03:00:00Z",
  "evidence_items": [
    {
      "id": "E-001",
      "kind": "executable_test",
      "locator": {
        "path": "research/synthesis/metamodel/test_reductions.py",
        "anchor": "def test_r5_base_form_registry_is_explicit(self) -> None:"
      },
      "review_state": "review_clean"
    },
    {
      "id": "E-002",
      "kind": "official-doc",
      "locator": {
        "path": "research/synthesis/metamodel/kill-tests.md",
        "anchor": "K70-01 — value equality is not entity identity"
      },
      "review_state": "review_clean"
    },
    {
      "id": "E-003",
      "kind": "official-doc",
      "locator": {
        "path": "research/synthesis/metamodel/review.md",
        "anchor": "**Architecture decision:** none"
      },
      "review_state": "review_clean"
    },
    {
      "id": "E-004",
      "kind": "official-doc",
      "locator": {
        "path": "research/kill/existing-platform/replace-os-report.md",
        "anchor": "Answer"
      },
      "review_state": "review_clean"
    },
    {
      "id": "E-005",
      "kind": "official-doc",
      "locator": {
        "path": "research/kill/existing-platform/scorecard.md",
        "anchor": "Property scorecard"
      },
      "review_state": "unreviewed"
    },
    {
      "id": "E-006",
      "kind": "official-doc",
      "locator": {
        "path": "docs/swarm-result-contract.md",
        "anchor": "8. Review/promotion gates"
      },
      "review_state": "review_clean"
    },
    {
      "id": "E-007",
      "kind": "official-doc",
      "locator": {
        "path": "research/ops/decision-discipline/conventions.md",
        "anchor": "Refuse these promotions"
      },
      "review_state": "unreviewed"
    },
    {
      "id": "E-008",
      "kind": "official-doc",
      "locator": {
        "path": "research/ops/decision-discipline/issue-0082-kinds-versus-verdicts.md",
        "anchor": "Q-002"
      },
      "review_state": "unreviewed"
    },
    {
      "id": "E-009",
      "kind": "design-claim",
      "locator": {
        "path": "research/WAVE-B-EXECUTION.md",
        "anchor": "Gate before #70"
      },
      "review_state": "unreviewed"
    },
    {
      "id": "E-010",
      "kind": "official-doc",
      "locator": {
        "path": "docs/open-questions.md",
        "anchor": "Open questions — intentionally unresolved"
      },
      "review_state": "review_clean"
    },
    {
      "id": "E-011",
      "kind": "executable_test",
      "locator": {
        "path": "research/verification/check_research.py",
        "anchor": "if registry[\"scenario_count\"] != 370 or registry[\"law_count\"] != 163:"
      },
      "review_state": "review_clean"
    },
    {
      "id": "E-012",
      "kind": "official-doc",
      "locator": {
        "path": "research/ops/failure-archive/README.md",
        "anchor": "It must not manufacture certainty retrospectively"
      },
      "review_state": "unreviewed"
    },
    {
      "id": "E-013",
      "kind": "design-claim",
      "locator": {
        "path": "research/synthesis/metamodel/candidate-metamodel.json",
        "anchor": "decision_state"
      },
      "review_state": "review_clean"
    },
    {
      "id": "E-014",
      "kind": "official-doc",
      "locator": {
        "path": "docs/constitution.md",
        "anchor": "17. RFCs are hypotheses until evidence promotes them"
      },
      "review_state": "review_clean"
    },
    {
      "id": "E-015",
      "kind": "official-doc",
      "locator": {
        "path": "docs/research-program.md",
        "anchor": "Exit criteria for implementation"
      },
      "review_state": "review_clean"
    },
    {
      "id": "E-016",
      "kind": "official-doc",
      "locator": {
        "path": "docs/swarm-research-backlog.md",
        "anchor": "#71 first executable vertical and semantic acceptance suite"
      },
      "review_state": "review_clean"
    },
    {
      "id": "E-017",
      "kind": "official-doc",
      "locator": {
        "path": "research/ops/cross-industry/README.md",
        "anchor": "Cross-industry primitive stress test"
      },
      "review_state": "unreviewed"
    },
    {
      "id": "E-018",
      "kind": "official-doc",
      "locator": {
        "path": "research/ops/cross-industry/matrix.md",
        "anchor": "# Primitive stress matrix"
      },
      "review_state": "unreviewed"
    }
  ],
  "open_questions": [
    {
      "id": "Q-001",
      "state": "blocking",
      "limit_refs": []
    },
    {
      "id": "Q-015",
      "state": "blocking",
      "limit_refs": []
    },
    {
      "id": "Q-018",
      "state": "blocking",
      "limit_refs": []
    },
    {
      "id": "Q-021",
      "state": "blocking",
      "limit_refs": []
    },
    {
      "id": "Q-002",
      "state": "blocking",
      "limit_refs": []
    }
  ],
  "experiment_case": {
    "question": "O corpus publicado em origin/research-corpus autoriza um experimento semântico limitado sem promover arquitetura?",
    "question_refs": [
      "E-009",
      "E-015"
    ],
    "hypothesis": "Há pergunta limitada, hipótese com falsificador, prova executável discriminante e limites suficientes para experimentar distinções já testáveis, sem tratar supported como accepted.",
    "hypothesis_refs": [
      "E-002",
      "E-015"
    ],
    "falsifier": "O experimento fica bloqueado se nenhum teste executável separar a hipótese de uma alternativa publicada, se a assessment fechar uma open question, ou se um artefato de research marcar accepted.",
    "falsifier_refs": [
      "E-002",
      "E-015"
    ],
    "discriminating_proof_refs": [
      "E-001",
      "E-011"
    ],
    "source_kind": "executable_test",
    "source_kind_refs": [
      "E-001",
      "E-006",
      "E-010"
    ],
    "limits": "O experimento não escolhe stack, linguagem, storage, metamodelo, R5 ou R6. Não fecha #71, #70, #80 nem docs/open-questions.md.",
    "limits_refs": [
      "E-003",
      "E-009"
    ],
    "normative_promotion": false,
    "normative_promotion_refs": [
      "E-003",
      "E-007",
      "E-013"
    ]
  },
  "stack_bakeoff_case": {
    "suite_published": false,
    "suite_ref": null,
    "candidates": [],
    "shared_measure_refs": [],
    "semantic_contract_refs": [
      "E-011"
    ],
    "source_shaped_exceptions": false
  },
  "architectural_promotion_case": {
    "cross_domain_demonstrated": null,
    "cross_domain_refs": [
      "E-011"
    ],
    "cross_industry_demonstrated": true,
    "cross_industry_refs": [
      "E-017",
      "E-018"
    ],
    "limited_kill_tests_demonstrated": null,
    "kill_test_refs": [
      "E-002",
      "E-004"
    ],
    "high_risk_semantics_demonstrated": true,
    "high_risk_semantics_refs": [
      "E-011"
    ],
    "competitors_reduced": false,
    "competitors_reduced_refs": [
      "E-013"
    ],
    "reviewed_sha": "76f5e62704fa7479eae21726480c62efbfd68b1f",
    "current_sha_review_ref": "E-003",
    "governance_process_ref": "E-006",
    "adoption_claim": "none"
  }
}
